{
  "$schema": "../../schema/bench.v1.json",
  "id": "cyclewire",
  "name": "CycleWire",
  "kind": "library",
  "summary": "The reference page activated by CycleWire, built from this repository's source, so every run measures the commit it runs on: the core loads up front, and each interaction's code loads when someone reaches for it. Nothing hydrates.",
  "build": "npm run build",
  "start": "node server.js",
  "search": "live",
  "packages": [
    "cyclewire"
  ],
  "idioms": [
    {
      "choice": "The core loads as a module in <head>, with a modulepreload link, as the performance guide recommends.",
      "docs": "https://github.com/CycleChain/CycleWire/blob/main/docs/performance.md#load-cyclewire-early"
    },
    {
      "choice": "Vite bundles the page's script, and fromGlob(import.meta.glob('./actions/*.js')) registers every action as its own chunk. Vite preloads a chunk's dependencies when it is imported.",
      "docs": "https://github.com/CycleChain/CycleWire/blob/main/docs/getting-started.md#4-register-and-start"
    },
    {
      "choice": "The server writes the entry's <script> and <link rel=\"modulepreload\"> tags from Vite's manifest, and the modulepreload polyfill is turned off rather than imported, as the backend integration guide allows. Preloading an action's imports stays on.",
      "docs": "https://vite.dev/guide/backend-integration"
    },
    {
      "choice": "Add to cart, the action most visitors use first, is preloaded with the page: the server writes <link rel=\"modulepreload\"> for its chunk and the chunks it imports, from Vite's manifest, so a tap on it right after the page appears waits only for the server. Everything else loads on intent, the default, and on touch screens also once the page is idle.",
      "docs": "https://github.com/CycleChain/CycleWire/blob/main/docs/performance.md#preload-the-action-people-reach-for-first"
    },
    {
      "choice": "The cart shows in one place, the header, so the cart action writes the new count and total into it, on the core alone: the modules guide keeps cyclewire/signals for state that several places show.",
      "docs": "https://github.com/CycleChain/CycleWire/blob/main/docs/modules.md#when-to-add-a-module"
    },
    {
      "choice": "The quick view fetches JSON and renders it with cyclewire/dom, which arrives with that action.",
      "docs": "https://github.com/CycleChain/CycleWire/blob/main/docs/modules.md#import-it-from-the-action-that-needs-it"
    },
    {
      "choice": "The quick view link names its data with cw-prefetch, and the prefetch plugin fetches it on intent, next to the action's code; the action's ctx.fetch() takes that response.",
      "docs": "https://github.com/CycleChain/CycleWire/blob/main/docs/performance.md#fetch-code-and-data-together"
    }
  ]
}
